{
  "schema_version": "contest-manifest-v2",
  "manifest_id": "synthetic-tampered",
  "version": "synthetic-tampered-v2",
  "frozen": true,
  "created_at": "2026-08-10T00:00:00Z",
  "label_normalization_version": "severity-v1",
  "split_policy_version": "whole-contest+source-family-v1",
  "provenance": [
    {
      "platform": "synthetic",
      "source_reference": "tampered-example",
      "retrieved_at": "2026-08-10T00:00:00Z"
    }
  ],
  "source_families": {
    "family:tampered": {
      "split": "test",
      "basis": "synthetic lineage",
      "contest_ids": ["synthetic:tampered"]
    }
  },
  "contests": {
    "synthetic:tampered": {
      "split": "test",
      "source_family_id": "family:tampered",
      "published_at": "2026-07-01T00:00:00Z",
      "source": {
        "source_snapshot_id": "snapshot-tampered",
        "revision": "changed-after-freeze",
        "source_tree_digest": "sha256:bbbbbbbbbbbbbbbbbbbbbbbbbbbbbbbbbbbbbbbbbbbbbbbbbbbbbbbbbbbbbbbb"
      },
      "case_ids": ["case-tampered"],
      "contamination": [
        {
          "model_id": "deterministic-v1",
          "knowledge_cutoff": null,
          "bucket": "unknown",
          "evidence_reference": "cutoff unavailable"
        }
      ]
    }
  },
  "content_digest": "sha256:0000000000000000000000000000000000000000000000000000000000000000"
}
