{
  "schema_version": "contest-manifest-v2",
  "manifest_id": "synthetic-family-leaking",
  "version": "synthetic-family-leaking-v1",
  "frozen": true,
  "created_at": "2026-08-10T00:00:00Z",
  "label_normalization_version": "severity-v1",
  "split_policy_version": "whole-contest+source-family-v1",
  "provenance": [
    {
      "platform": "synthetic",
      "source_reference": "semantic-invalid-example",
      "retrieved_at": "2026-08-10T00:00:00Z"
    }
  ],
  "source_families": {
    "family:forks": {
      "split": "train",
      "basis": "same synthetic fork lineage",
      "contest_ids": ["synthetic:fork-a", "synthetic:fork-b"]
    }
  },
  "contests": {
    "synthetic:fork-a": {
      "split": "train",
      "source_family_id": "family:forks",
      "published_at": "2026-01-01T00:00:00Z",
      "source": {
        "source_snapshot_id": "snapshot-fork-a",
        "revision": "a",
        "source_tree_digest": "sha256:aaaaaaaaaaaaaaaaaaaaaaaaaaaaaaaaaaaaaaaaaaaaaaaaaaaaaaaaaaaaaaaa"
      },
      "case_ids": ["case-fork-a"],
      "contamination": [
        {
          "model_id": "deterministic-v1",
          "knowledge_cutoff": null,
          "bucket": "unknown",
          "evidence_reference": "synthetic"
        }
      ]
    },
    "synthetic:fork-b": {
      "split": "test",
      "source_family_id": "family:forks",
      "published_at": "2026-02-01T00:00:00Z",
      "source": {
        "source_snapshot_id": "snapshot-fork-b",
        "revision": "b",
        "source_tree_digest": "sha256:bbbbbbbbbbbbbbbbbbbbbbbbbbbbbbbbbbbbbbbbbbbbbbbbbbbbbbbbbbbbbbbb"
      },
      "case_ids": ["case-fork-b"],
      "contamination": [
        {
          "model_id": "deterministic-v1",
          "knowledge_cutoff": null,
          "bucket": "unknown",
          "evidence_reference": "synthetic"
        }
      ]
    }
  },
  "content_digest": "sha256:dddddddddddddddddddddddddddddddddddddddddddddddddddddddddddddddd"
}
